Questions,Viewed Amount
Delete column from pandas DataFrame,349892
How to deal with SettingWithCopyWarning in Pandas?,70567
Add new column in Pandas DataFrame Python,48351
Python Pandas - How to flatten a hierarchical index in columns,26120
how to combine two data frames in python pandas,22474
pandas joining multiple dataframes on columns,22013
Pandas dataframe get first row of each group,19280
How can I obtain the element-wise logical NOT of a pandas Series?,17452
What does axis in pandas mean?,16099
How to import data from mongodb to pandas?,14436
